out,sentences
0,About the job
0,SEO Director - Technical Focus
0,"We're seeking an experienced SEO Director to lead our agency's search engine optimization efforts, with a particular emphasis on technical SEO."
0,"In this role, you'll drive organic growth for our clients through innovative strategies and cutting-edge technical optimizations."
0,Responsibilities:
0,Technical SEO Leadership:
0,"Spearhead technical SEO audits, identifying and prioritizing critical issues impacting site performance and search visibility"
0,"Develop and implement advanced technical SEO strategies, including site architecture optimization, crawlability improvements, and indexation management"
0,Collaborate with development teams to review code and make cogent change requests that consider technical limitations
0,Strategy and Execution:
0,Create comprehensive SEO roadmaps aligned with client KPIs and business objectives
0,"Oversee the execution of on-page and off-page SEO tactics, ensuring alignment with best practices and search engine guidelines"
0,"Stay at the forefront of SEO trends, algorithm updates, and emerging technologies, incorporating new approaches into client strategies"
0,Develop and execute local SEO programs for both brick and mortar and service area type businesses
0,Team Management and Client Relations:
0,"Lead and mentor a team of SEO specialists, fostering a culture of continuous learning and innovation"
0,"Serve as the primary point of contact for high-priority clients, communicating complex SEO concepts in clear, actionable terms"
0,Collaborate with cross-functional teams to integrate SEO with broader digital marketing initiatives
0,Help in the strategy development and planning for new business pitches as well as the delivery of the pitch
0,Requirements:
0,"7+ years of SEO experience, with at least 2-3 years in a leadership role"
1,"Deep expertise in technical SEO, including experience with JavaScript frameworks, e-commerce platforms, and various content management systems"
1,"Strong analytical skills with proficiency in SEO tools like Google Search Console, Site Crawlers, BrightEdge, Conductor, Similarweb, Botify, etc."
0,Proven track record of driving significant organic growth for clients through technical SEO optimizations
0,Excellent project management abilities and experience leading cross-functional teams
0,"Strong communication skills, both written and verbal, with the ability to explain complex technical concepts to non-technical stakeholders"
0,Preferred Qualifications
0,Agency and in-house corporate experience preferred
1,"Advanced knowledge of HTML, CSS, and JavaScript"
0,Familiarity with log file analysis and large-scale data processing
0,Experience with international SEO and hreflang implementation
1,Understanding of machine learning (AI) and its applications in SEO
0,Experience in planning and executing business pitches/proposals
0,"At our agency, you'll have the opportunity to work with diverse clients, leverage cutting-edge SEO tools, and lead a team of talented professionals."
0,"If you're passionate about technical SEO and ready to drive organic growth at scale, we want to hear from you."
1,"The Business Systems Project Manager will provide analysis, design, programming solutions, and support for SAP S4HANA business systems efficiently and economically consistent with user & business objectives."
0,"They will prioritize projects, allocate resources, and be an application specialist."
1,"In addition, they will plan and direct the installation and support of business systems SAP S4 projects involving multiple systems impacting multiple functional areas of the business."
0,Required Skills:
1,Demonstrated project management experience and configuration & programming knowledge in SAP ECC and/or SAP S/4HANA. SAP S/4HANA experience is a plus.
1,Experience with business intelligence and report writing platforms.
1,Experience using 3rd Party tools/systems with SAP.
0,Strong analytical and problem-solving skills.
0,Excellent oral and written communication skills using the English language to translate business needs into application system changes to ensure successful business processes.
0,Required Work Experience:
0,Education Requirements:
1,"BS in Management Information Systems, Computer Science, or a related field"
0,Job Title: Tech-Savvy Financial Planner - Join Our Innovative Team!
0,Job Description:
0,"Are you looking for a forward-thinking, technology-driven firm that offers a collaborative and growth-oriented environment?"
0,"Join our dynamic financial planning team, where we serve high-net-worth clients nationwide."
0,"In this role, you will deliver tailored financial planning services to an existing book of business and have the opportunity to build your own client base within the Mountain Time Zone."
0,"We’re looking for a self-motivated, detail-focused professional passionate about financial planning and eager to grow within a supportive team."
0,"In this role, you will:"
0,Leverage innovative tools and technology to streamline financial planning processes and enhance client experiences.
0,"Build and maintain strong relationships with clients, ensuring their financial goals are met through comprehensive financial planning."
0,Contribute to the refinement of our wealth transition strategies and planning services.
0,Embrace opportunities for professional development in a fast-evolving financial landscape.
0,Qualifications and Experience:
1,Experience with eMoney is a must
0,"At least 5 years in financial advisory, including advice planning, book of business management, and client relations, with minimum of 2+ years in wealth management for high-net-worth individuals."
0,Proven track record in managing a client book of business with high levels of client satisfaction and loyalty.
1,"Strong understanding of financial planning, investment strategies, and industry regulations."
0,Demonstrated experience applying trust and estate planning principles to enhance clients' wealth preservation.
0,"Bachelor’s degree from an accredited institution; preferred majors include financial planning, finance, or accounting."
1,"Preferred designations include CFP, CPA, CIMA, or EA, or equivalent experience and education."
0,"FINRA Series 7, 63+65, or 66 license"
1,"Familiarity with financial planning software (eMoney preferred), tax modeling (BNA Income Tax Planner preferred), and tax preparation software (CCH Access preferred)."
1,Proficiency with Excel and data visualization tools.
0,"Exceptional analytical skills, as well as strong written and verbal communication abilities."
0,Company Overview:
0,"The AmeriFlex Group is a leading Hybrid RIA, helping clients navigate major life transitions."
0,"With headquarters in Las Vegas, NV, our team of over 200 advisors across the country manages assets exceeding $13 billion."
1,We prioritize a planning-first approach and offer a unique hybrid platform that includes an advisor-owned RIA with a Partner Advisor ownership model.
0,Our Broker/Dealer partner is Osaic.
0,Location:
0,Flexible - Remote or In-Person (Mountain Coast Time Zone Preferred)
0,Salary and Benefits:
0,"Earn a competitive salary between $120,000 and $175,000, depending on your experience and credentials."
0,"Our comprehensive benefits package includes a 401(k), health insurance, and reimbursement for approved professional development expenses."
0,Application Process:
0,"To apply, please send your resume and a compelling cover letter to Stacy Leal at stacy@theameriflexgroup.com."
0,Contact Information:
0,Stacy Leal | Phone: 702-987-9730 | AmeriFlex.com
0,Equal Opportunity Employer Statement:
0,The AmeriFlex Group is committed to fostering a diverse and inclusive workplace.
0,"We are an equal opportunity employer, and all qualified candidates will receive consideration for employment regardless of race, color, religion, sex, sexual orientation, gender identity, national origin, protected veteran status, or disability."
0,We are seeking an experienced Class C Licensed Groundwater Plant Operator.
0,The ideal candidate will be responsible for operating and maintaining equipment used in the treatment of groundwater to ensure compliance with regulatory standards.
0,*Duties*
0,Utilize logic controllers to monitor and control groundwater treatment processes
0,Operate heavy equipment for water treatment purposes
0,"Build, maintain, and repair water treatment systems"
0,Apply mechanical knowledge to troubleshoot and resolve equipment issues
0,Use basic math skills to analyze data related to groundwater treatment processes
0,Collect data on water quality and treatment efficiency
0,Work with distributed control systems to manage groundwater treatment operations
0,*Skills*
0,Proficiency in groundwater treatment processes
0,Experience with logic controllers for monitoring and controlling systems
0,Ability to operate heavy equipment effectively
0,Strong mechanical knowledge for maintenance and repair tasks
1,Basic math skills for data analysis
0,Capability to analyze and maintain groundwater treatment systems
0,Familiarity with data collection methods in groundwater treatment operations
0,"Job Types: Full-time, Temporary"
0,Pay: $73.00 per hour
0,Expected hours: 40 per week
0,Schedule:
0,8 hour shift
0,Day shift
0,Monday to Friday
0,Weekends as needed
0,Required Experience:
0,Plant Operator: 5 years (Required)
0,Wastewater treatment: 2 years (Preferred)
0,Groundwater: 5 years (Required)
0,Groundwater monitoring: 5 years (Required)
0,Groundwater remediation: 5 years (Required)
0,Class C License (Required)
0,Class C License with Class B: Preferred
0,Ability to Commute:
0,"Houston, TX (Required)"
0,Ability to Relocate:
0,"Houston, TX: Relocate before starting work (Required)"
0,Work Location:
0,In person
0,Company Description
0,"D2 Integrity, LLC was founded in 2022 to create value for our clients by providing efficient and world class engineering, software, and consulting services."
1,"We specialize in pipeline integrity management, ILI technology, regulatory compliance, and software enabled engineering services."
0,We strive to provide our clients an enjoyable professional environment.
0,Our differentiator is our staff and collaborative culture.
0,"We are headquartered in Houston, TX."
0,Role Description
0,"D2 Integrity, LLC is looking to grow our team with an In-line inspection (ILI) Specialist."
0,This is a full-time position that is primarily remote work with scheduled in person meetings.
1,The ILI Specialist will be responsible for working Integrity Engineers to perform analysis and assessments using ILI data.
1,"Principal tasks include performing calculations, data analysis, generating reports, and supporting client directly."
0,Responsibilities
1,Interpret ILI reports and signal data for various ILI technologies.
1,Perform calculations and data integration using ILI data for integrity assessments related various integrity threats including but not limited to:
1,Dent Strain and ECA using geometry ILI data
1,Bending strain and strain change assessments using IMU ILI data
1,Box matching and CGR analysis using MFL and UT ILI data.
1,Various other ILI related tasks associated with signal analysis.
1,"Support Integrity Engineer implement various evaluations using API 1163, API 1176, and API 1183."
0,Produce reports to document results of analysis.
1,Maintain an understanding of various ILI technologies work and their application in integrity assessments.
1,Demonstrate working knowledge of regulatory requirements related to ILI.
0,"Display strong organizational and communication skills related to status of projects, analysis performed, and results of assessments."
0,Delivery work and reports on-time.
0,Develop and maintain competency in various service offerings.
0,Identify learning opportunities for self-improvement.
0,Identify process improvement opportunities.
0,Adhere to the company handbook.
0,Qualifications
1,"Current level 2/3 ILI Data Analyst certification is preferred (MFL, GEO, IMU, UT, EMAT)."
1,"BS in Science, Technology, Engineering, or Mathematics is preferred, or equivalent experience."
1,Minimum of 5 years of related experience in inspection analysis or pipeline integrity management.
1,"Experience with ILI data analysis and interpretation, including MFL, UT, and other NDE technologies."
1,Strong data analysis and communication skills.
1,Knowledge of GIS software and spatial data analysis is a plus.
0,Considerations:
0,Sponsorship not available.
0,Canadian and Mexican applicants eligible as contractors.
0,Compensation & Benefits
0,Full-Time Position
0,Work Remote
0,Competitive Salary
0,Quarterly Bonus
0,Annual Bonus
0,"Medical, Dental and Vision Insurance (US only)"
0,401K (US only)
0,"The Director of Institutional Research & Decision Support plays a crucial role at our college, leading efforts to strategically utilize data for informed decision-making."
0,"This senior position involves guiding the quality and interpretation of data, and synthesizing it to enhance processes and inform planning."
0,"In collaboration with senior leadership, the Director ensures that equitable student outcomes remain a primary focus through comprehensive research and planning."
0,Empathetic Communication: able to communicate complex technical concepts to non-technical stakeholders with grace fostering a collaborative and inclusive team environment.
0,Enjoys puzzles and solving problems: solving problems and extracting actionable insights from data to provide answers or solutions.
0,"Strategic Thinker: able to think strategically about how data can be leveraged to drive innovation, gain competitive advantage, and create value for the college."
0,REQUIRED QUALIFICATIONS:
0,"• Three (3) years of administrative experience with data science, institutional research, compliance reporting"
0,• Three (3) years of supervisory experience.
1,• Experience with visualization tools such as Power BI and R/Python.
0,• Two (2) years of supervisory experience
0,• Familiarity with research on college student persistence and success.
0,• Project management certification (PMP).
1,Chalice Custom Algorithms (chalice.ai) is the leading AI application for brands applying their own data and analytics in the real-time decisioning of ad buys.
1,"Chalice’s software automates data ingestion, predictive analytics, and deployment of custom bidding instructions in a supervised-learning environment, where advertisers can visualize and test their custom algorithms."
0,"Advertisers’ algorithms can be deployed in all major DSPs, as well as Meta and YouTube."
1,"Chalice was named “Best Demand Side Tech” by AdExchanger, and powered AdWeek’s “Best Use of Programmatic” in the 2023 Media Plan of the Year awards."
0,Key Responsibilities:
0,"As a Lead Associate Director at Chalice, you will:"
0,Act as a Leader: lead customer success initiatives with impact across the company.
0,Establish scalable processes to build a high-performing customer success team.
1,"Consult on Product Development: Collaborate across Solutions Architecture, Data Science and Engineering to develop products and features that best support customer adoption and growth."
1,"Lead Technical Problem Solving: Collaborate with engineers, data scientists, and product managers to address complex technical issues."
1,Consult with customers on troubleshooting APIs.
0,Qualifications:
1,"7+ Years Experience: Demonstrated experience in within ad tech, either in customer success, ad ops, client services or trading."
1,Experience with data science centric and applied AI technologies is a plus.
1,"Technical Proficiency: Familiarity with programmatic and ideally, social, advertising platforms and AI technologies is a plus, allowing for efficient troubleshooting and guidance."
1,"Joining Chalice means being at the forefront of AI for advertising, working in a stimulating and dynamic environment that encourages creativity, growth, and innovation."
0,"We value diversity, collaboration, and dedication to making a meaningful impact in the advertising landscape."
0,Chalice is a profitable early-stage company with funding from industry insiders including Trade Desk’s TD7 Ventures and Aperiam Ventures.
0,Chalice’s philosophy:
1,AI is too important for brands to outsource
1,AI should be transparent and auditable
0,We strive for excellence while fostering learning and creating a supportive work environment.
0,"We are a team of non-conformist, independent thinkers"
0,"We are committed to and driven by diversity of thought, background, and experience, and creating the psychological safety for all to thrive"
0,"To learn more about Chalice, visit our website."
0,www.chalice.ai
0,Location:
0,"Chalice is based in NYC, with a hybrid office/remote work site."
0,"This role is based in NY, with the expectation of 1-2 days a week in office."
0,Compensation:
0,"This role offers a competitive base salary with a range of $120,000 – $150,0000, depending on experience."
0,Compensation includes equity in a fast growing early stage company.
0,Benefits include:
0,Medical
0,Dental/vision
0,401k options
0,Unlimited PTO
0,11 Company Holidays
0,Office wide closure between Christmas Eve and New Years
1,"If you're ready to be part of a team that's shaping the future of advertising through custom AI solutions, reach out, and let's create something amazing together!"
0,Chalice participates in E-Verify.
0,"Chalice will provide the Social Security Administration (SSA) and, if necessary, the Department of Homeland Security (DHS), with information from each new employee’s Form I-9 to confirm work authorization."
0,"For more information, visit https://www.uscis.gov/e-verify."
0,Codédex is looking for a Senior Curriculum Developer (Contractor) to spearhead the curriculum production.
0,This is a full-time contract position for 3 months with an opportunity to transition into a full-time salary + equity position and join the founding team.
0,"You can expect ~40 hours of work per week with daily standup meetings, bi-weekly curriculum meetings, and twice a month 1:1s."
0,👾 What is Codédex?
0,Codédex is a brand new learn to code platform for Gen Z.
0,Our mission is to empower the next generation of technologists with the absolute best learning experience!
0,"The pillars that make up Codédex: gamification, world-class content, and community."
0,https://www.codedex.io
0,"We are based in Brooklyn, NY."
0,We work from our office in Dumbo two days a week (Tue & Thu) and WFH the other three (MonWedFri).
0,"We are remote-friendly (CST or EST), but prefer a NYC-based candidate."
0,👤 Responsibilities
0,Architect byte-sized interactive coding exercises
0,Review project tutorials written by the community
0,"Apply pedagogy best practices and break down dry technical concepts into fun, digestible components"
0,Collaborate closely with the Engineering team to innovate and push the boundaries of learning to code online
0,Co-lead the Curriculum bi-weekly meetings and move the ball forward
0,Address bug reports and curriculum feedback from the community
0,Lead workshops and office hours 1-2 times a quarter
0,Report to Founder & CEO
0,🧳 Qualifications
1,"3+ years of working experience in curriculum writing, technical writing, or similar, preferably in EdTech"
1,"Strong foundation in web dev, data science, and/or AI (HTML/CSS, JS, React, Command Line, Python, etc.)"
1,Proficiency in Markdown and GitHub
0,A strong command of written and spoken English
0,Experience writing educational content that reaches a broad audience of different age groups
0,Experience in communicating with remote/hybrid teams
0,"Scrappy, resourceful, and enjoy working in a fast-paced (sometimes chaotic!) startup environment"
0,Self-motivated and a BIG team player
0,🔥 Bonus Points
0,Professional experience teaching in the classroom and/or online
1,Deep knowledge of the popular EdTech platforms
0,Sweat the details and has an eye for design
0,Want to grow with the company for years to come
0,Get in on the ground floor early and receive a once-in-a-lifetime experience building a startup
0,"Work and grow alongside stellar, ultra-passionate teammates in NYC office (lunches provided)"
0,Attend quarterly offsites in NYC (or elsewhere)
0,Opportunity to transition into a full-time member of the founding team after 3 months
0,"The hourly pay range for this position is $35-$45, depending on experience"
0,⌚️ Hiring Process
0,20 min: Screening call with the hiring manager.
0,Submit past work/portfolio examples or submit a short and compensated take-home assignment.
0,30 min: Team call with 2 team members.
0,30 min: Final interview with hiring manager (prefer onsite).
0,The team huddles internally and follows up on the decision!
0,"If this seems like a fit for you, apply and connect with us!"
0,Office Tour: https://www.instagram.com/p/C_0s3YBOP8s
0,Team: https://www.codedex.io/about
0,"If you're enthusiastic about working in a service-oriented role and are eager to contribute to our mission, we encourage you to apply today!"
0,Requirements:
0,Bachelor’s degree
0,"5+ years of experience in retail operations, preferably in a credit union or banking environment."
0,Who you are
0,"At least 5-10 years of relevant experience, ideally in a consulting environment or as part of an in-house, cross-functional product team."
1,"Strong versatility and experience with products across multiple digital platforms including iOS, Android, Web, TV, Auto, Voice, Wearables, IoT and other smart devices."
1,Excellent communication skills and a strong ability to present and defend strategic choices persuasively.
0,Bonus points if you...
0,"This role reports to the Vice President, Operations."
0,FLSA STATUS: EXEMPT
0,"Salary Range: $107,000 - $130,000"
0,ESSENTIAL DUTIES AND RESPONSIBILITIES:
1,"o Develop, maintain, and optimize PowerBI dashboards, analytic reports, and data visualizations by documenting user requirements for all departments."
1,"Perform data mining in the data lake using SQL and other tools to extract valuable insights by serving as the subject matter expert for the company's data lake, understanding where and how data is stored."
0,MINIMUM QUALIFICATIONS
0,"EDUCATION, TRAINING, AND EXPERIENCE"
1,"o Bachelor’s degree in industrial engineering, business analytics, statistics, business intelligence, or related field or experience."
1,"o 5 years’ experience performing Operations business analysis/intelligence, such as quantitative and qualitative analysis, predictive analytics, business case development, operations analysis, etc."
1,o Lean Six Sigma Black Belt Certification
0,Special Requirements
0,o Must be able to pass a criminal background check and obtain and maintain federally mandated security clearances required to work at an airport.
0,o Valid Driver’s License required
0,o Valid Passport with ability to obtain travel Visa / Travel Authorization as required
0,"KNOWLEDGE, SKILLS, ABILITIES."
0,AND OTHER WORK REQUIREMENTS
0,KNOWLEDGE
1,"o Core competencies in statistics, visualization, and data mining and modeling."
1,"o Experience and understanding of a wide variety of analytical processes, tools, and approaches."
1,o High level understanding of data gathering and transformation tools
0,SKILLS
1,o Expert Level PowerBI or Tableau (Inclusive of Dax Programming)
1,o Intermediate Level of SQL Developer (Oracle)
1,o Predictive Modeling/Forecasting (Time Series Analysis & Other Regression Initiatives)
1,"o Expert Level of Microsoft Excel (VBA, PowerQuery, and Access Add ins)"
0,"o Active listening: Give full attention to what other people are saying, take time to understand the points being made, ask questions as appropriate, and not interrupt at inappropriate times."
0,o Time management: Manage one’s own time or the time of others.
0,o Coordination with others: Adjust actions in relation to others' actions.
0,o Judgement and decision making: Consider the relative costs and benefits of potential actions to choose the most appropriate one.
0,ABILITIES
0,o Experience structuring and delivering presentations and communications targeted to company leadership and stakeholders.
0,"o Ability to work independently and efficiently, often without direct supervision."
0,o Ability to quickly learn potentially unfamiliar topics.
0,o Excellent verbal and communication skills.
0,o Aviation industry experience preferred.
0,o Comprehend oral information: Listen to and understand information and ideas presented through spoken words and sentences.
0,o Speak: Communicate information and ideas in speaking so others will understand.
1,"· Management of small but growing team of front-end, back-end, DevOps, and data science employees/consultants"
1,"· Bachelors degree in Computer Science, Data Science, or related subject"
1,· Java/Java Script development and best practices
1,"· Advanced degree in data science, computer science, and/or management"
1,"· Expertise in Python, R, and IoT systems"
1,"Experience with programming and data analysis languages (e.g., Python, R, Matlab, and Fortran)."
1,"Bachelor's or Masters degree or additional certifications in Computer Science, Data Science, or a related field."
1,"· Master’s Degree in a relevant discipline such as health administration, public health, data science or business, or bachelor’s degree with relevant experience."
1,The Department of Electrical and Computer Engineering seeks to hire a faculty member with expertise in Trustworthy AI and machine learning.
1,"Key areas of interest include, but are not limited to robustness, security, privacy, interpretability, fairness and safety in machine learning and AI from systems and/or theoretical perspectives."
1,"Desired experience includes X-Midas, Python, GNU-Radio, Julia, or MATLAB development skills."
