out,sentences
1,"Familiarity with DSP Techniques (such as Cyclo-Stationary processing, Cumulants, CAFs, Polyphase Filterbanks, etc), Radar Processing, Wireless Communications, Artificial Intelligence & Machine Learning, and/or Satellite Engineering."
1,"C/C++, Python, Julia in a Linux development environment."
1,"Basic understanding of Fortran, Java, Perl, JavaScript, XML, JSON, and other languages will aid in development"
1,"Familiarity with Cython, SWIG, and other Pythonic/C wrappers with cross-compiler support is desired."
1,"Nice to Have, Machine Learning / Artificial Intelligence Experience"
1,"Familiarity with Python libraries such as scikit-learn, scikit-image, numpy, scipy, mayavi, matplotlib, pandas, keras, tensorflow, caffe, nltk, statsmodels, pybrain"
1,"Integrated Data Sciences – We’re pursuing advanced data sciences to create novel end-user inspired solutions that address complex analysis, simulation, and prediction across the translational sciences."
1,"Partner with technical analytics + data science resources to build experimentation roadmap, create actionable performance analysis, establish reporting views, and distill insights from all the above that feed back into the media strategy"
1,"Strong quantitative, programming skills in Python and SQL, and familiarity with TabPy."
1,"Analytics experience using Big Data, Python, or R."
1,"Be the subject matter expert around machine learning, statistical, and econometric time series techniques alongside hybrids of these to develop accurate, granular demand forecasts"
1,"Experience in statistical/econometric time series modeling (ARIMA, Exponential Smoothing/ETS, GLMs/GAMs, Dynamic Factor Models, etc.), machine learning (XGBoost/LightGBM, RNNs, Transformers, etc.), or hybrid time series techniques (ES-RNN, N-BEATS, TFT)."
1,"Proficiency in Python, SQL, Git"
1,"Our consultants leverage advanced analytics, machine learning, and our cloud-based, automated modeling platform to build predictive sales models and deliver business insights that change how clients plan, advertise, and grow their business."
1,"Oversee modelers who will sculpt the data for ingestion into our tools, usually in Python."
0,"Help clients understand where they are spending too much or too little, what worked or didn’t work, and why."
0,Build marketing budget optimizations and help clients maximize sales and marketing ROI.
0,We have clients that license our software for their own modeling.
0,Some days we are coaching them to be great modelers too.
1,"Graduate degree in analytics, data science, operations research, industrial engineering, statistics, economics, or other quantitative field"
0,4 years marketing mix modeling experience
1,Some Python skills.
1,We’re mainly a Python shop on the analytics consulting team.
1,"Good knowledge of regression, elastic net, or other related machine learning methods."
1,"So we might ask you to work on a variety of things (marketing mix models, price and promotion models, automated machine learning projects, coaching clients on their modeling projects)."
1,"Has deep knowledge of one or more of the following domains: Embedded CPU subsystem and architecture; High-speed digital signal processing, computer vision, or machine learning; High-performance serial interface protocols; Low-power design methodology; mixed-signal design; FPGA prototyping."
1,Strong RTL (Verilog/System Verilog/VHDL) coding skills and hands-on experience in programming languages (Perl/Tcl/Python/C).
1,"We also utilize SageMaker for machine learning, Kafka for real-time data streaming, Route 53 for DNS services, and Secrets Manager for secure access management."
1,"Proficiency in programming languages such as Python and Go is essential, alongside experience with DevOps tools like Docker and GitLab to support efficient and secure development and deployment processes."
1,"Expertise in a wide variety of programming languages such as C, C++, C#, Python, Matlab, Simulink."
1,"Experience with machine learning, computer vision, or autonomous systems."
1,"Experience with statistical software such as SQL, R, Python, and Power BI."
1,Experience in developing and implementing machine learning algorithms for predictive insights.
1,"Successful candidates will be expected to teach beginning through advanced topics in biostatistics, statistical literacy, and statistical programming in SAS, STATA, SPSS, R or Python, both to mathematically inclined students and to math-apprehensive students at the undergraduate and graduate levels."
1,"If you have a strong interest to influence next-generation development of High Performance Computing Processor for Supercomputers, Graph Analytics/AI/Machine Learning SOCs or custom ASICs to partner with Xeon processor, this is the team to join."
1,"· Proven proficiency in Python programming and familiarity with data analysis tools such as R, MATLAB, or SQL."
1,"About Syntes AI: Syntes AI is at the forefront of the AI and Machine Learning revolution, offering a cutting-edge enterprise framework that integrates data management, AI/ML, and advanced analytics into a single, powerful platform."
1,"Strong understanding of AI, machine learning, or data management is highly preferred."
1,"Knowledge of data analysis tools (e.g., Google Analytics, Power BI, Tableau, Looker, Helium 10, Jungle Scout, Data Studio, SQL, Python, Supermetrics, etc.)"
1,"5+ years experience within Data Science, Data Engineering, and Machine Learning domains and their practical applications"
1,"Hands on experience with machine learning algorithms like random forest, linear and logistic regressions, gradient boosting, classification, GANs, and anomaly detection algorithms for building, evaluating, deploying and monitoring ML models from scratch."
1,Strong proficiency in Python and SQL
1,"Extensive knowledge and working experience with Machine Learning libraries/frameworks, and data processing/visualization tools."
1,"Drive data science initiatives to harness predictive analytics, AI, and machine learning for enhanced decision-making and product development."
1,"Proficiency in data science methodologies and tools (e.g., Python, R, SQL, TensorFlow)."
1,"● Proficiency in programming languages such as Python, R, or Matlab."
1,● Strong understanding of statistical methods and machine learning algorithms.
1,"● You have machine learning experience, particularly in applying ML techniques to radar signal processing tasks."
1,"Visualize insights using Microsoft Office, Tableau, Python, R"
1,"Design, develop, and test ML applications using Python, Linux, Docker"
1,"Expertise in Python, R, SQL, statistics, data mining"
1,"Programming experience in R and Python, with a strong understanding of their ecosystems, libraries, and best practices"
1,· Designing predictive models and machine learning algorithms to mine return data sets
1,"· Strong programming skills and experience with Python, R language"
1,"· Machine learning, other data modeling skills"
1,"Design, develop, and maintain statistical / machine learning data models, metrics, and algorithms that can be used to analyze large datasets related to music consumption, project performance, and market trends to drive significant results."
1,"Utilize advanced analytics tools and platforms (e.g., SQL, Python, R, Tableau, BigQuery, AWS Bedrock, etc) for data processing and visualization at scale."
1,"Expert proficiency in SQL based data manipulation, analysis tools (e.g., Python, R), ETL processes, and data visualization platforms (e.g., Tableau, Power BI, BigQuery)."
1,"Algorithm Development:  Develop and refine trading algorithms that automate decision-making processes, leveraging machine learning and AI techniques."
1,"Machine Learning and AI: Proficiency in machine learning algorithms and experience with AI techniques, particularly in the context of predictive modeling, anomaly detection, and natural language processing (NLP)."
1,"Programming Languages: Strong coding skills in languages like Python, commonly used for data analysis, modeling, and automation."
1,"Proven experience (5-7 years) in programming languages, machine learning, data visualization and statistical analysis."
1,"This individual will work with our senior management across multiple departments under the direction of the Director of Software Strategy to analyze and prepare automated reports with clear KPI’s, while working with a Google Big Query Data Warehouse and utilizing statistical and machine learning models."
1,"Develop and implement statistical and machine learning models to provide correlation analysis, prediction behavior, and ."
1,Proficiency in programming languages such as Python or R for use in data analytics.
1,Strong understanding of statistical analysis and machine learning techniques.
1,"Provide business insights via thorough analysis, integrate diverse data, contribute to advanced quantitative methods for customer segmentation, maintain statistical models (R/Python), apply statistical/machine learning techniques for trend extraction."
1,"Assist in development, maintenance, and enhancement of statistical models in R or Python (there is a preference for open-source coding);"
1,Use statistical and machine learning (ML) techniques to extract and analyze trends from the database / data warehouse;
1,Experience in applying advanced statistical and machine learning (ML) techniques
1,"Experience with econometric modeling, regression analytics or machine learning"
1,"Experience in Python, Spark, Scala, or R for large scale data analysis"
1,"Python, Jupyter Notebook, Scala, Databricks"""
1,"We also excel in vision applications leveraging Machine Learning (ML), YOLO, OpenCV, and multimodal LLMs for industries such as pharmaceuticals, semiconductors, automation, robotics, defense technology, and core engineering sectors (mechanical, embedded, signal processing, control systems, drones, missiles)."
1,"Our diverse workforce includes skilled tradespeople; artificial intelligence, machine learning (AI/ML) experts; engineers; technologists; scientists; logistics experts; and business administration professionals."
1,"Proficiency in Python, SQL, Pandas and other relevant machine learning libraries."
1,Designing and developing machine learning and deep learning systems
1,"The project combines machine learning, large-eddy simulation, and table-top experiments."
1,"Skills to look for: Linux, Networking, Automation, Python/ Java, Data Analytics"
1,"Excellent programming skills in Python, Java, and proficiency in other programming languages."
1,Are you a System Administrator who is interested in developing your skills and deepening your experience related to Artificial Intelligence (AI)/ Machine Learning (ML) and Data Science (DS)?
1,"An interest in data science, data engineering, or machine learning"
1,"The project tech stack: Apache Spark, Hive, Java, Scala, Spring, SQL, Kafka, Hadoop."
1,"We are looking for a strong Senior Java Developer with Big Data experience (Hadoop, Spark) capable of build the design and establish the framework in order to expose and distribute the Risk data to wide variety of consumers including Finance, Front office Risk Systems, Trading Systems, Back office and Account systems."
1,"The role of the Senior Java Developer involves working with strong development teams, the opportunity to work with big data improving knowledge in this domain utilizing the resources of an international bank."
1,• Strong Knowledge of Java programming languages
1,Extensive knowledge of building machine learning models from scratch.
1,Proficiency in manipulating large scale data using Python and SQL
0,Qualifications
0,Bachelor's Degreed (Preferred)
0,2+ years of Procurement experience
0,2+ years of Contracts experience
0,Stakeholder management experience required
1,SAP Experience (Preferred)
0,Hours
1,"Using our proprietary platform combining spatial biology, pooled screening, in silico protein engineering, and machine learning, we can obtain both depth and breadth when screening cell therapy candidates – speed without compromising on in vivo accuracy."
0,"In addition, Northrop Grumman provides a variety of benefits including health insurance coverage, life and disability insurance, savings plan, Company paid holidays and paid time off (PTO) for vacation and/or personal business."
0,The application period for the job is estimated to be 20 days from the job posting date.
0,"However, this timeline may be shortened or extended depending on business needs and the availability of qualified candidates."
0,Northrop Grumman is committed to hiring and retaining a diverse workforce.
0,"We are proud to be an Equal Opportunity/Affirmative Action Employer, making decisions without regard to race, color, religion, creed, sex, sexual orientation, gender identity, marital status, national origin, age, veteran status, disability, or any other protected class."
0,"For our complete EEO/AA and Pay Transparency statement, please visit."
0,U.S. Citizenship is required for all positions with a government clearance and certain other restricted positions.
0,About Ascendion
0,Ascendion is a full-service digital engineering solutions company.
0,We make and manage software platforms and products that power growth and deliver captivating experiences to consumers and employees.
1,"Our engineering, cloud, data, experience design, and talent solution capabilities accelerate transformation and impact for enterprise clients."
1,"Experience with Snowﬂake, Looker (LookML), BigQuery, Python, Vertex AI, and related technologies is a plus."
1,"In this role, you will lead teams designing and building data solutions that capture, explore, transform and utilize data to support Artificial Intelligence, Machine Learning and business intelligence/insights."
1,"Advanced programming skills in Python, R, and/or other relevant languages; experience with software development best practices and version control systems."
1,"Experience in the application of machine learning techniques to large biological datasets, with a particular focus on genetic data, is highly desirable."
1,"Proficiency in the use of at least one computer/database programming such as, but not limited to, JAVA, C++, Python, R, VB, SQL, MS Access, Tableau/PowerBI, etc."
1,"A little about ADP: We are a global leader in human resources technology, offering the latest AI and machine learning-enhanced payroll, tax, human resources, benefits, and much more."
1,"You are the ideal candidate if you are a recognized researcher with strong skills in cybersecurity, computer engineering/science, RF signal processing, machine learning, mathematics, modeling and simulation, and/or physics; you desire an opportunity to pursue external funding from government research agencies (e.g. DARPA, IARPA, DoD Service Labs) to help further U.S. National Security Objectives and betterment of society; you know how to attract, hire and develop top-notch talent to round out your team."
1,5. 5 years of experience in machine learning algorithms.
1,Strong aptitude for problem solving and working with large data sets and implementing machine learning models.
0,SKILLS AND ABILITIES:
0,Essential Skills:
0,Experience developing and maintaining models of complex electrical and mechanical systems
1,Familiarity in SysML modeling software or model-based engineering concepts
1,Familiarity with MATLAB and Simulink
0,Results-oriented and motivated to provide solutions with measurable benefit to our customers
0,Ability to communicate complex analysis with clarity and precision
1,Proficiency in Microsoft Office applications
0,Strong written and verbal communication skills
0,"Shipboard or industrial experience with machinery system installation, operational testing, troubleshooting, and repair is preferred"
1,Knowledge of Agile Project Management
0,"Experience with the system engineering life cycle, including requirements, design, development, integration, testing, and deployment"
0,Desired Skills / Certifications:
1,OMG SysML Model Builder Fundamental certification is a plus.
0,Model Builder Intermediate preferred.
1,Advanced degree or certificate in System Engineering -OR- INCOSE ASEP or higher is a plus.
0,"US Navy HM&E experience US Navy HM&E experience or industry experience in power generation, power distribution, control systems, ventilation systems, damage control, firefighting, auxiliary machinery, propulsion systems, navigational, steering, fluid storage & transfer systems such as for lube/fuel/oil/water, and combat system is a plus"
0,Travel:
0,"This position may require occasional travel, estimated to be 5-10%."
0,"Philadelphia, PA"
0,Clearance Level:
0,Secret
0,Type:
0,Equal Opportunity Policy:
0,"TDI Technologies, Inc. provides equal employment opportunities to all employees and applicants for employment and prohibits discrimination and harassment."
0,"This policy applies to all terms and conditions of employment, including recruiting, hiring, placement, promotion, termination, layout, recall, transfer, leaves of absence, compensation and training."
0,Want to see more?
0,Find all job opportunities for both BioFire and bioMérieux worldwide by clicking here.
1,DSEs efficiently utilize data mining techniques e.g. ELT/ETL to develop the reporting/visualization solution.
1,"The DSE understands ERP, CRM, and other business applications and their relationship."
1,"Experience with one of the following programming/analytical languages: R, Python, C#, Java, JavaScript, DBT, and D3.JS."
0,"Pratt Industries is America's 5th largest paper and packaging company with more than 9,000 highly skilled green collar employees dedicated to the environment and sustainability."
0,"Pratt Industries is one of the largest corrugated packaging companies in America, with sophisticated manufacturing facilities in more than twenty states."
0,"The company operates several of the most modern, cost effective paper mills in the country, as well as a series of sheet and box plants strategically placed throughout the United States offering a wide range of creative packaging solutions."
0,Pratt Industries is committed to recycling and the environment by harvesting the urban forest.
0,"Pratt Industries offers competitive compensation plans with incentive opportunities, full benefits package including medical, dental, vision, life, disability, All State, Pre-Paid Legal, and 401(k) with company match, paid vacation, paid holidays, and childbearing and parental leave."
1,We are seeking a highly skilled and motivated AI/Automation Engineer/Systems Integrator to join our innovative team.
1,The ideal candidate will have a strong background in integrating advanced AI
0,"technologies into manufacturing processes, with a focus on enhancing efficiency, productivity, and"
0,quality.
1,"This role requires a hands-on professional with a deep understanding of AI, machine learning, automation systems, and systems integration."
1,Algorithm Development: Create and deploy machine learning algorithms and models to
1,"Experience: Proven experience in AI, machine learning, and automation within a"
1,"Technical Skills: Proficiency in programming languages such as Python, R, and C++."
1,"Industry Certifications: Relevant certifications in AI, machine learning, or automation"
1,"Proven experience in data analysis, statistical modeling, and machine learning."
1,"Proficiency in programming languages such as Python, R, or SQL."
0,Required Experience
1,"8+ years of experience in IT/Information Security Governance in large, global organizations (e.g., consulting, audit, industry/operations)"
1,"Experience in processes monitoring, defining and follow up of KPIs, basic data analysis"
1,"Experience in reporting, knowledge of ServiceNow reporting capability is a plus"
1,"Experience in working with data protection related regulations, e.g., GDPR, GLBA, eIDAS is a plus"
1,"Security Governance/Risk Management certification (CISSP, CGEIT, CISM, CRISC ..) is a plus"
1,"Knowledge of relevant security/governance frameworks (NIST CSF, ISO27001, …) is a plus"
0,Tools & Methodologies
1,MS Tools
1,ServiceNow IRM
0,Agile Methodology
0,Risk Management
0,Apply now
0,"Location Krakow, Lesser Poland, Poland;"
0,"Bengaluru, Karnataka, India;"
0,"Raleigh, North Carolina, United States of America;"
0,"Vaesteras, Vastmanland County, Sweden;"
0,"Remote - Karnataka, India;"
0,"Remote - North Carolina, United States of America Job type Full time Experience Experienced Job function IT, Telecom & Internet Contract Regular Publication date 2024-09-16 Reference number R0054767"
0,ADP Is Hiring a Lead Data Scientist
0,"Are you a mid-level Data Scientist who has not only sharp technical skill, but also a deep curiosity and passion for creating insights from data that can drive real business change?"
0,Do you enjoy collaboration and the opportunity to prove your skills?
0,Do you enjoy a challenge which demands you flex creative and logical problem-solving skills?
0,"Well, this may be the role for you."
0,Ready to design what's next?
0,"In this role, you will take ownership of data science initiatives, utilizing diverse methodologies to analyze data from multiple sources, and deliver strategic recommendations to our business partners."
0,Your impact will grow as you bring these solutions to life across multiple businesses.
1,"Additionally, you will support a range of analytics projects leveraging your skills in NLP, GenAI, statistical modeling, ML, Python, SQL, and Tableau."
1,Develop and deploy machine learning models to improve business processes and outcomes.
1,"Stay current with industry trends, emerging technologies, and best practices in data science and machine learning."
1,"A little about ADP: We are a global leader in HR technology, offering the latest AI and machine learning-enhanced payroll, tax, HR, benefits, and much more."
1,"Advanced Analytics and Modeling: Apply various analytical methods, including statistical and machine learning models (Python, R), to identify key drivers of client experience and deliver actionable recommendations to enhance business outcomes."
1,"Strong programming skills in Python, R,or similar languages."
1,"Experience with machine learning frameworks (e.g., TensorFlow, Scikit-learn, PyTorch)."
1,"Proven experience in crafting, testing and deploying ML /GenAIprojects in Python with keen focus on eliciting optimal outputs."
0,Job Title:
0,Remote Sensing Scientist
0,Job Location:
0,"Seattle, WA; St. Louis, MO; Remote"
0,HabiTerre is an advanced science and technology company dedicated to delivering actionable insights and digital infrastructure to support and sustain the future of food and agriculture.
0,"We envision a world where a resilient food system, environmental stewardship, and on-farm profitability are harmonized to ensure the sustainability of every farm field on our planet."
1,"4+ Years hands-on experience in Python development, scientific data visualization and analysis."
1,"Proven experience in applying machine learning and deep learning techniques to agricultural monitoring using frameworks such as PyTorch, TensorFlow, and Scikit-Learn."
1,Knowlege of Machine Learning modeling and AI prompt engineering.
0,"2+ years of Institutional Investment Operations experience, or equivalent demonstrated through one or a combination of the following: work experience, training, military experience, education."
0,Experience with DTC settlements or a similar clearing corporation.
0,"Working knowledge of Broadridge systems including GLOSS, Impact, and BPS."
0,BS/BA degree in Finance or related field.
0,Series 7 or Series 99.
0,Strong accounting background with knowledge of reconciliation.
0,2+ years of experience in the securities industry.
0,Ability to demonstrate effective analytical skills.
0,Detail-oriented with effective organizational skills.
0,Energetic individual that works well under pressure in a team environment with demanding deadlines.
0,Ability to identify areas of improvement and formulate plans to effect positive change within a team environment.
1,"Collaborate effectively with cross-disciplinary teams across machine learning, computational materials and chemical sciences, and software engineering."
1,"Experience executing quantum chemical calculations at scale, with HPC or cloud computing systems, and with Python or similar | 5+ years of experience"
1,"• Algorithm development experience in any programming language (i.e., proficiency with MATLAB, Python or C++)"
1,"We are seeking a Sr. Data Scientist with expertise in travel analytics, data engineering, and machine learning to join our dynamic team."
1,"Proficiency in Python, SQL, PySpark, and ML algorithms."
1,"Strong background in API development, data pipelines, and machine learning models."
1,Management of machine learning data
1,"Relevant areas of expertise might include large-installation systems administration, programming and scripting of distributed systems in Python, high performance data-parallel computing, systems software, and deployment of security tools, but specific knowledge of and level of experience in any of these areas is less critical than intellectual curiosity, versatility, and a track record of achievement."
1,"DESRES uses Anton machines and high-speed commodity hardware, together with machine learning methods and other computational techniques, in both internal and collaborative drug discovery programs."
0,"Basic life insurance, 401(k) with company match"
0,Employee Assistance Program
0,"Employee discounts on vehicle purchases, parts and service"
0,Paid-time-off
0,"We also offer a group of supplemental benefit plans including dental coverage, short-term disability, long-term disability, supplemental life insurance and legal services."
0,Opportunities for career advancement.
